UK,UK Schools Seismic Network,University of Leicester (SEIS UK),GB (United Kingdom),http://www.le.ac.uk/seis-uk/school_resources.html,United Kingdom,
UL,USGS Low Frequency Geophysical Data Network,USGS Menlo Park,US (United States),http://quake.geo.berkeley.edu/ul/ul.overview.html,United States,
UM,University of Montana Seismic Network,University Of Montana,US (United States),,United States,10.7914/SN/UM
UN,Uganda National Seismological Network,"Directorate of Geological Survey and Mines, Uganda",UG (Uganda),,Uganda,10.7914/SN/UN
UO,University of Oregon Regional Network,University of Oregon,US (United States),,United States,
UP,Swedish National Seismic Network,Uppsala University,SE (Sweden),http://www.snsn.se/,Sweden,10.18159/SNSN
UR,UKArray,British Geological Survey,GB (United Kingdom),,United Kingdom,10.7914/SN/UR
US,United States National Seismic Network,Albuquerque Seismological Laboratory (ASL)/USGS,US (United States),,United States,10.7914/SN/US
UU,University of Utah Regional Seismic Network,University of Utah,US (United States),http://www.seis.utah.edu/,United States,10.7914/SN/UU
UW,Pacific Northwest Seismic Network,University of Washington,US (United States),http://www.pnsn.org/,United States,10.7914/SN/UW
UY,Observatorio Geofisico del Uruguay,Universidad de la Republica,UY (Uruguay),http://ogu.fcien.edu.uy,Uruguay,10.7914/SN/UY
UZ,Uzbekistan Digital Seismic Network,"Uzbekistan Institute of Seismology, Tashkent",UZ (Uzbekistan),,Uzbekistan,
VC,Red Nacional de Vigilancia Volcánica Chile (VC),Servicio Nacional de Geología y Minería,CL (Chile),http://www.sernageomin.cl/,Chile,
VE,Red Sismologica Nacional con Apertura Continental,"Fundación Venezolana de Investigaciones Sismológicas (FUNVISIS), Caracas",VE (Venezuela),,Venezuela,
VG,Seismic Network of the Indonesian Center for Volcanology and Geological Hazard Mitigation,Pusat Vulkanologi dan Mitigasi Bencana Geologi,ID (Indonesia),,Indonesia,10.7914/SN/VG
VI,Icelandic National Digital Seismograph Network,Icelandic Meteorological Office,IS (Iceland),http://en.vedur.is/earthquakes-and-volcanism/earthquakes/,Iceland,
VL,Vale SA Network,"Universidade de Sao Paulo, USP",BR (Brazil),,Brazil,10.7914/SN/VL
VT,Taiwan Volcano Observatory,Taiwan Volcano Observatory,TW (Taiwan),,Taiwan,10.7914/SN/VT
VU,Vanuatu Seismic Network,Vanuatu Geoscience Observatory,VU (Vanuatu),,Vanuatu,
WA,West Central Argentina Network,"Universidad Nacional de San Juan (UNSJ, Argentina)",AR (Argentina),,Argentina,
WB,West Bohemia Local Seismic Network,"Institute of Geophysics, Academy of Sciences of the Czech Republic",CZ (Czech Republic),http://www.ig.cas.cz/struktura/oddeleni/seismika/zapadoceska-zemetreseni,Czech Republic,10.7914/SN/WB
WC,Curacao Seismic Network,Meteorologische Dienst Curacao,CW (Curaçao),,Curacao,
WI,West Indies French Seismic Network,Institut de Physique du Globe de Paris,FR (France),,West Indies,10.18715/antilles.WI
WK,Wake Island Hydrophone Array,University of Hawaii (UH),US (United States),,United States,
WM,Western Mediterranean Seismic Network,Real Instituto y Observatorio de la Armada (Spain),ES (Spain),,Spain,10.14470/JZ581150
WR,California Division of Water Resources,California Division of Water Resources,US (United States),,United States,
WS,Seismic Network of Repuplika Srpska,Republicki Hidrometeorološki Zavod,RS (Serbia),,Bosnia and Herzegovina,
WU,The Southern Ontario Seismic Network,University of Western Ontario (UWO Canada),CA (Canada),http://www.gp.uwo.ca/docs/stationmap.html,Canada,
WY,Yellowstone Wyoming Seismic Network,University of Utah,US (United States),,United States,10.7914/SN/WY
